{
  "id": "m06.rub",
  "schema_version": "1.0.0",
  "@id": "https://legalpracticum.org/spine/rubric/m06.rub",
  "matter_id": "m06",
  "declared_total": 189,
  "criteria": [
    {
      "id": "m06.rub.c01",
      "name": "Temporary-injunction standard analysis",
      "description": "Correctly identifies and applies the temporary-injunction standard and the reasonableness factors governing restrictive covenants; separates the enforceability question from the trade-secret question.",
      "weight_points": 70,
      "skill_id": "SK-LP-02",
      "task_id": "TSK-011",
      "subcriteria": [
        {
          "id": "m06.rub.c01.s01",
          "name": "Likelihood of success on the merits",
          "description": "Analyzes whether the covenant is reasonable in scope, geography, and duration, and whether the pricing data is a protectable trade secret given how loosely it was guarded.",
          "weight_points": 40
        },
        {
          "id": "m06.rub.c01.s02",
          "name": "Irreparable harm, balance of equities, public interest",
          "description": "Weighs the employer's claimed harm against the employee's loss of livelihood and the public interest in labor mobility.",
          "weight_points": 30
        }
      ]
    },
    {
      "id": "m06.rub.c02",
      "name": "Fact development and investigation",
      "description": "Gathers and organizes the facts that decide the case — how the spreadsheet was handled, what was actually taken, and whether any customer was solicited — from the client, witnesses, and exhibits.",
      "weight_points": 35,
      "skill_id": "SK-LP-07",
      "task_id": "TSK-023"
    },
    {
      "id": "m06.rub.c03",
      "name": "Persuasive written advocacy",
      "description": "Produces a clear, well-organized, rule-compliant memorandum opposing the injunction, with an accurate statement of facts and a disciplined argument.",
      "weight_points": 44,
      "skill_id": "SK-LP-17",
      "task_id": "TSK-032"
    },
    {
      "id": "m06.rub.c04",
      "name": "Professional-responsibility and client-counseling judgment",
      "description": "Recognizes the no-contact rule as to Northlake's represented director of sales, and candidly counsels the client about the risk created by copying the file and forwarding the email.",
      "weight_points": 40,
      "skill_id": "SK-LP-16",
      "task_id": "TSK-060"
    }
  ],
  "letter_grade_map": [
    { "grade": "A", "points": 189 },
    { "grade": "A-", "points": 178 },
    { "grade": "B+", "points": 167 },
    { "grade": "B", "points": 155 },
    { "grade": "C", "points": 132 }
  ]
}
