{
  "id": "m14.rub",
  "schema_version": "1.0.0",
  "@id": "https://legalpracticum.org/spine/rubric/m14.rub",
  "matter_id": "m14",
  "declared_total": 185.5,
  "criteria": [
    {
      "id": "m14.rub.c01",
      "name": "Fact development & title-issue diagnosis",
      "description": "Reads the case file and interview to correctly identify and separate the three title problems and who controls each cure.",
      "weight_points": 40,
      "skill_id": "SK-LP-07",
      "task_id": "TSK-023",
      "subcriteria": [
        {
          "id": "m14.rub.c01.s01",
          "name": "Access-easement defect identified",
          "description": "Recognizes that the recorded 1991 easement does not match the surveyed road and that the title company will not insure access as written.",
          "weight_points": 20
        },
        {
          "id": "m14.rub.c01.s02",
          "name": "Mineral & well reservations grasped",
          "description": "Correctly characterizes the severed mineral estate (owned by a third party, not conveyable) and the seller's newly demanded well reservation as distinct issues.",
          "weight_points": 20
        }
      ]
    },
    {
      "id": "m14.rub.c02",
      "name": "Negotiation strategy & execution",
      "description": "Builds and executes a strategic settlement-and-negotiation plan that separates interests from positions and trades terms across the three issues toward a closeable deal.",
      "weight_points": 60,
      "skill_id": "SK-LP-13",
      "task_id": "TSK-046",
      "subcriteria": [
        {
          "id": "m14.rub.c02.s01",
          "name": "Interests vs. positions / SSNP quality",
          "description": "Identifies the client's true interests (unobstructed flat, insurable access, hidden deadline) and the seller's likely interests, not just stated positions.",
          "weight_points": 30
        },
        {
          "id": "m14.rub.c02.s02",
          "name": "Cross-issue tradeoffs to a closeable deal",
          "description": "Proposes realistic trades (price, cost allocation, bounded/relocated well reservation, access cure) that both sides could accept.",
          "weight_points": 30
        }
      ]
    },
    {
      "id": "m14.rub.c03",
      "name": "Client counseling on options & risk",
      "description": "Advises the client in plain language on realistic options and their costs, risks, and timelines, and elicits the decisions only the client can make.",
      "weight_points": 35,
      "skill_id": "SK-LP-10",
      "task_id": "TSK-034"
    },
    {
      "id": "m14.rub.c04",
      "name": "Drafting deed & access terms",
      "description": "Produces clear proposed deal terms: deed form and warranty, access-easement cure and cost allocation, and any well reservation.",
      "weight_points": 30,
      "skill_id": "SK-LP-17",
      "task_id": "TSK-062"
    },
    {
      "id": "m14.rub.c05",
      "name": "Professional responsibility — no-contact rule",
      "description": "Recognizes the seller is represented, refrains from direct contact, and counsels the client to route communications through opposing counsel.",
      "weight_points": 20.5,
      "skill_id": "SK-LP-16",
      "task_id": "TSK-060"
    }
  ],
  "letter_grade_map": [
    { "grade": "A", "points": 185.5 },
    { "grade": "A-", "points": 176 },
    { "grade": "B+", "points": 167 },
    { "grade": "B", "points": 158 },
    { "grade": "C", "points": 139 }
  ]
}
